{
  "feature": {"name": "<功能名稱>", "slug": "<feature-slug>"},
  "architecture": {
    "overview": "<系統概述：哪些 service、用什麼資料表、Redis 怎麼用>",
    "diagram": "flowchart LR\n  C[Cocos Client] -->|HTTP| G[API Gateway]\n  G --> S[Feature Service]\n  S --> R[(Redis)]\n  S --> D[(MySQL)]",
    "data_flow": "<Client ↔ Server 資料流說明>"
  },
  "client": {
    "scene": "<Cocos Creator 場景結構>",
    "components": [
      {"name": "<ComponentName>", "desc": "<職責>"}
    ],
    "states": [
      {"from": "<State A>", "trigger": "<事件>", "to": "<State B>"}
    ],
    "update_strategy": "<HTTP polling / WebSocket / 開啟拉一次>",
    "performance": "<效能考量>"
  },
  "apis": [
    {
      "id": "api-xxx",
      "method": "GET",
      "path": "/api/v1/<resource>",
      "desc": "<一句話>",
      "auth": "Bearer Token",
      "reads": "<例如 MySQL.<table_name> / Redis:<key-pattern>>",
      "writes": "<例如 MySQL.<table_name> / Redis:<key-pattern>>",
      "query_params": [
        {"name": "<param>", "type": "string", "default": "<default>", "desc": "<說明>"}
      ],
      "response_200": "{\n  \"code\": 200,\n  \"data\": { }\n}",
      "response_errors": [
        {"code": "401", "desc": "<未登入>"}
      ],
      "flow": ["<步驟 1>", "<步驟 2>"],
      "perf": "<p95 < Xms / QPS Y>",
      "related_bdd": ["sc-001"]
    }
  ],
  "data_models": [
    {
      "name": "<table_name>",
      "kind": "MySQL Table",
      "desc": "<用途>",
      "fields": [
        {"name": "id", "type": "BIGINT UNSIGNED PK AUTO_INCREMENT", "desc": "PK"},
        {"name": "<col>", "type": "<MySQL type>", "desc": "<說明>"}
      ],
      "indexes": "<INDEX/UNIQUE 設計>",
      "apis": ["api-xxx"]
    }
  ],
  "business_logic": [
    {
      "title": "<邏輯名稱>",
      "desc": "<說明>",
      "pseudocode": "// pseudo-code"
    }
  ],
  "cache_strategy": [
    {"key": "<redis-key-pattern>", "ttl": "<TTL>", "desc": "<用途>"}
  ]
}
